{"capabilities":["web.search"],"data_access_labels":[],"description":"Synthetic tool web-search","destructive":false,"idempotent":null,"input_schema":{"additionalProperties":false,"properties":{"query":{"type":"string"}},"type":"object"},"name":"web-search","namespace":"web","output_schema":null,"protocol":"fixture","risk_tags":[],"schema_version":"0.1","server_id":null,"side_effect_class":"READ","tool_id":"web-search","version":null}
